{
  "schema": "modelport/0.1",
  "id": "toy_rgb",
  "version": "1.0.0",
  "task": "image-classification",
  "license": "MIT",
  "name": "Toy RGB",
  "description": "A pretend model for code generation tests.",
  "variants": [
    {
      "id": "onnx-fp32",
      "runtime": "onnx",
      "precision": "fp32",
      "file": {
        "path": "weights.dat",
        "size": 64,
        "sha256": "fdeab9acf3710362bd2658cdc9a29e8f9c757fcf9811603a8c447cd1d9151108"
      },
      "extra_files": []
    }
  ],
  "inputs": [
    {
      "name": "pixel_values",
      "dtype": "float32",
      "shape": [
        1,
        3,
        4,
        4
      ],
      "layout": "NCHW",
      "preprocess": {
        "type": "image",
        "resize": {
          "size": [
            4,
            4
          ],
          "method": "bilinear",
          "antialias": false
        },
        "color": "RGB",
        "scale": 0.00392156862745098,
        "mean": [
          0.0,
          0.0,
          0.0
        ],
        "std": [
          1.0,
          1.0,
          1.0
        ]
      }
    }
  ],
  "outputs": [
    {
      "name": "logits",
      "dtype": "float32",
      "shape": [
        1,
        3
      ],
      "postprocess": {
        "type": "classification",
        "activation": "softmax",
        "labels": {
          "path": "labels.txt",
          "size": 15,
          "sha256": "9fec8b87d457cdab76088586670cbcc3b6f5f39ef95b320c07f4ec2b539c2be4"
        },
        "top_k": 5
      }
    }
  ]
}
