{
  "schema": "modelport/0.1",
  "id": "mobilenet_v3_small",
  "version": "1.0.0",
  "task": "image-classification",
  "license": "BSD-3-Clause",
  "name": "MobileNetV3 Small",
  "description": "ImageNet-1k classifier from torchvision. Small and fast, good for a first test.",
  "source": "torchvision:mobilenet_v3_small",
  "variants": [
    {
      "id": "onnx-fp32",
      "runtime": "onnx",
      "precision": "fp32",
      "file": {
        "path": "onnx-fp32/model.onnx",
        "size": 10461888,
        "sha256": "69c712c3637efad9168e46e4ab6b488af181c20bde7734305cfd30927395bdac"
      },
      "min_ram_mb": 256
    },
    {
      "id": "executorch-xnnpack-fp32",
      "runtime": "executorch",
      "backend": "xnnpack",
      "precision": "fp32",
      "file": {
        "path": "executorch-xnnpack-fp32/model.pte",
        "size": 10205344,
        "sha256": "8ff10907a0dc09d661449018e769ce35349eca63cb110edc38ee715f6c7ebb36"
      },
      "min_ram_mb": 256
    }
  ],
  "inputs": [
    {
      "name": "pixel_values",
      "dtype": "float32",
      "shape": [1, 3, 224, 224],
      "layout": "NCHW",
      "preprocess": {
        "type": "image",
        "resize": { "shorter_side": 256, "method": "bilinear", "antialias": true },
        "center_crop": [224, 224],
        "color": "RGB",
        "scale": 0.00392156862745098,
        "mean": [0.485, 0.456, 0.406],
        "std": [0.229, 0.224, 0.225]
      }
    }
  ],
  "outputs": [
    {
      "name": "logits",
      "dtype": "float32",
      "shape": [1, 1000],
      "postprocess": {
        "type": "classification",
        "activation": "softmax",
        "labels": {
          "path": "labels.txt",
          "size": 10488,
          "sha256": "ee4fa67b1dd46919ef87529b70e25bdd1ec9ebd350de3ad426e6640eb70320a1"
        },
        "top_k": 5
      }
    }
  ],
  "golden": {
    "inputs": {
      "pixel_values": {
        "path": "golden/pixel_values.bin",
        "size": 602112,
        "sha256": "791a0f0caae0b9e4a81d7ad9fe3db67514bc2f67fbff71fb4d29f6cd66ff011d"
      }
    },
    "outputs": {
      "logits": {
        "path": "golden/logits.bin",
        "size": 4000,
        "sha256": "f2370d40c35c4d0af493b4eb9a38a250dc8624777c9e2e0f4e82ffae2531618f"
      }
    },
    "tolerance": { "atol": 0.001, "rtol": 0.001 }
  }
}
